{
  "schemaVersion": 1,
  "release": "0.7.0",
  "currentFocus": {
    "phase": 4,
    "summary": "Fechar o contrato versionado da camada 1 do SDK Lua, queries e projectors.",
    "next": "Declarar e medir projectors read-only antes de avançar para migrations de conteúdo."
  },
  "phases": [
    {
      "id": 1,
      "title": "Estado canônico e catálogo de capacidades",
      "status": "completed",
      "owners": ["CLI", "contratos de estado"],
      "dependencies": [],
      "adrs": ["0009"],
      "objective": "Dar à IA uma representação única, navegável e regenerável do estado da engine e do projeto.",
      "delivered": [
        {
          "summary": "Estado derivado, catálogo de capabilities, manifests de run e fitness functions.",
          "evidence": ["cli/src/project-state.ts", "CAPABILITIES.json", "contracts/run-manifest.schema.json"]
        }
      ],
      "remaining": [],
      "gate": "Uma sessão nova encontra estado, capabilities, limitações e evidência compatível sem pesquisar o repositório inteiro."
    },
    {
      "id": 2,
      "title": "Context Engine, CLI e Development Runner",
      "status": "completed",
      "owners": ["CLI", "BrowserHost", "ElectronHost"],
      "dependencies": [1],
      "adrs": ["0013"],
      "objective": "Fazer da CLI a interface operacional oficial entre IA, engine, hosts e toolchain.",
      "delivered": [
        {
          "summary": "CLI estruturada, cache por família, watch afetado e lifecycle de processos com dono único.",
          "evidence": ["cli/src/artifact-cache.ts", "cli/src/build-runner.ts", "cli/src/process-runner.ts"]
        }
      ],
      "remaining": [],
      "gate": "Uma sessão executa, interrompe, reconstrói e inspeciona um projeto com comandos reproduzíveis e sem processos órfãos."
    },
    {
      "id": 3,
      "title": "AI Control Plane e observabilidade causal",
      "status": "completed",
      "owners": ["CLI", "control protocol", "scenario harness", "BrowserHost"],
      "dependencies": [1, 2],
      "adrs": ["0010", "0014", "0015"],
      "objective": "Permitir que a IA controle uma execução real e rastreie um defeito do input até a apresentação.",
      "delivered": [
        {
          "summary": "Control protocol, harness, replay, contratos de UI e captura raster com baseline.",
          "capabilities": ["operability.control-harness"],
          "evidence": ["contracts/control-protocol.schema.json", "cli/src/scenario-harness.ts", "cli/src/raster-capture.ts"]
        },
        {
          "summary": "Cadeia de pixels para trace de projeção, estado lógico e tick no mesmo run.",
          "evidence": ["renderer-three/src/index.ts", "contracts/rendered-ui-snapshot.schema.json"]
        },
        {
          "summary": "Matriz raster aprovada para desktop, telefone, texto ampliado e device scale factors 1x e 2x.",
          "evidence": ["tools/tests/card-roguelite.mjs", "examples/card-roguelite/tests/baselines/card-roguelite"]
        }
      ],
      "remaining": [],
      "gate": "Um defeito nos pixels é correlacionado a estado, ação, evento, projector e origem, reproduzido por cenário e anexado ao artifact bundle."
    },
    {
      "id": 4,
      "title": "Autoria text-first de gameplay, UI e conteúdo",
      "status": "active",
      "owners": ["kernel", "Lua SDK", "content compiler", "presentation protocol"],
      "dependencies": [3],
      "adrs": ["0004", "0016", "0017", "0018", "0044", "0048", "0053"],
      "objective": "Permitir que jogos sejam criados por APIs públicas textuais sem alterar internals da engine.",
      "delivered": [
        {
          "summary": "Lua sandboxed com estado por símbolo, timers, fixed-point, streams de RNG e diagnósticos estáveis.",
          "capabilities": ["runtime.lua-gameplay"],
          "evidence": ["kernel/src/lua_sandbox.cpp", "tests/runtime/runtime_test.cpp", "tests/fixtures/determinism.lua"]
        },
        {
          "summary": "Content pack versionado, determinístico, rastreável e carregado pelo kernel em todos os hosts.",
          "capabilities": ["runtime.content-binding"],
          "evidence": ["content-compiler/src/pack.ts", "kernel/src/content_pack.cpp", "tools/tests/card-roguelite.mjs"]
        }
      ],
      "remaining": [
        "Contrato público e versionado da camada 1 do SDK, incluindo queries declarativas e maturidade por símbolo.",
        "Projectors read-only declarados e medidos separadamente.",
        "Migrations explícitas de schema e conteúdo com fixtures.",
        "Grafo textual compilado de cenas, prefabs e recursos com IDs estáveis.",
        "Statecharts determinísticas com guards/actions registrados, save, hash e replay.",
        "Gate integrado de UI, localização, navegação, foco, touch targets e breakpoints."
      ],
      "gate": "Uma sessão nova cria regra, conteúdo, tela, apresentação e cenário usando apenas APIs públicas."
    },
    {
      "id": 5,
      "title": "Runtime espacial e mundo procedural",
      "status": "partial",
      "owners": ["kernel spatial runtime", "world runtime", "job system"],
      "dependencies": [4],
      "adrs": ["0018", "0019", "0039", "0045", "0054"],
      "objective": "Criar uma fundação opt-in para mapas pequenos, mundos extensos e sandboxes virtualmente infinitos.",
      "delivered": [
        {
          "summary": "Posição composta, identidade e lifecycle de chunk, commit determinístico de jobs e geração pura sem seams.",
          "capabilities": ["spatial.runtime-foundation"],
          "evidence": ["kernel/src/world_position.cpp", "kernel/src/world_chunks.cpp", "tests/kernel/kernel_test.cpp"]
        },
        {
          "summary": "Janela de streaming com residência estável e regeneração idêntica ao revisitar.",
          "evidence": ["kernel/src/world_streaming.cpp", "capabilities/spatial-runtime-foundation/capability.json"]
        }
      ],
      "remaining": [
        "Jobs assíncronos reais sem alterar a ordem de commit.",
        "Simulation LOD, catch-up lógico e inspeção de regiões, chunks, jobs e caches.",
        "Posição com região e partitioning interno comprovado pelo consumidor.",
        "Regiões de navegação, pathfinding, links, obstacles, agents e avoidance por adapter.",
        "Superfície pública apenas quando um jogo declarar a capability."
      ],
      "gate": "O runtime gera, carrega, descarta e regenera chunks determinísticos com memória estabilizada em viagens longas."
    },
    {
      "id": 6,
      "title": "Motion, física e Mass Simulation",
      "status": "planned",
      "owners": ["motion runtime", "physics adapters", "Mass Runtime"],
      "dependencies": [5],
      "adrs": ["0021", "0022", "0037", "0045"],
      "objective": "Entregar movimento formal, física por adapters e multidões em níveis de simulação declarados.",
      "delivered": [],
      "remaining": [
        "Motion por tempo declarado e comandos semânticos.",
        "Adapters Jolt 3D e Box2D 2D com autoridade, quantização e replay.",
        "Mass Runtime contíguo, níveis de simulação, promoção controlada e budgets."
      ],
      "gate": "Movimento, física e hordas permanecem observáveis, reproduzíveis e dentro dos budgets aprovados."
    },
    {
      "id": 7,
      "title": "Persistência, replays e multiplayer player-hosted",
      "status": "partial",
      "owners": ["kernel", "storage", "network runtime"],
      "dependencies": [5, 6],
      "adrs": ["0023", "0024", "0038"],
      "objective": "Preservar mundo e sessões player-hosted com compatibilidade e recuperação explícitas.",
      "delivered": [
        {
          "summary": "Saves lógicos versionados, migrations básicas, replays, checkpoints e equivalência native/WASM.",
          "capabilities": ["runtime.save-replay"],
          "evidence": ["kernel/src/state_archive.cpp", "kernel/src/runtime.cpp", "tools/tests/wasm-equivalence.mjs"]
        }
      ],
      "remaining": [
        "Region storage atômico com journal, compactação, recovery e migrations.",
        "Salvamento por seed, generator version e deltas sem duplicar o mundo regenerável.",
        "Salas host-authoritative, transport adapters, late join, reconexão e host migration."
      ],
      "gate": "Save mundial sobrevive a crash e migration, replay localiza divergência e uma sala casual suporta seu lifecycle completo."
    },
    {
      "id": 8,
      "title": "Renderer, UI, áudio e apresentação escalável",
      "status": "partial",
      "owners": ["presentation protocol", "renderer-three", "UI renderer", "hosts"],
      "dependencies": [3, 4, 5, 6, 7],
      "adrs": ["0014", "0015", "0020", "0025", "0040", "0047", "0049", "0050", "0051", "0052"],
      "objective": "Apresentar jogos pequenos e massivos com observabilidade e degradação sem alterar gameplay.",
      "delivered": [
        {
          "summary": "Renderer Three.js experimental, UI DOM acessível, Web Audio e partículas simples.",
          "capabilities": ["presentation.three", "feedback.audio-effects"],
          "evidence": ["renderer-three/src", "hosts/browser/src/ui-renderer.ts", "hosts/browser/src/audio-feedback.ts"]
        }
      ],
      "remaining": [
        "Perfis web-compatible, desktop-compatible e desktop-high com fallback gráfico observado.",
        "Ingestão glTF/GLB, cooking, LOD, compressão, residência e streaming por target.",
        "Materiais e ambientes por tiers, shader warmup, cache e fallback verificável.",
        "Grafos de animação com blend, layers, masks, retarget, IK e root motion controlado.",
        "VFX GPU/CPU com trails, subemitters, colisão, pooling e budgets.",
        "Buffers contíguos, instancing, LOD, culling, pooling e terrain streaming.",
        "UI completa por teclado, controle e touch com baselines por perfil.",
        "Budgets de voz e memória, prioridade, deduplicação, música adaptativa e fallback observável."
      ],